163,Would you rather never have to work again or have your dream job?
164,Would you rather be able to talk to your past self or your future self?
165,Would you rather have a rewind button or a pause button for your life?
166,Would you rather be able to build anything you can imagine or be able to fix anything that is broken?
167,Would you rather be able to see 10 minutes into the future or 150 years into the future?
168,Would you rather have the ability to change your appearance at will or the ability to change your voice at will?
169,Would you rather be the funniest person in the room or the most intelligent?
170,Would you rather be able to communicate with plants or be able to communicate with computers?
171,Would you rather have a house that cleans itself or a car that drives itself?
172,Would you rather always know when someone is lying or get away with any lie you tell?
173,Would you rather have a unicorn horn or a squirrel tail?
174,Would you rather be able to jump 50 feet in the air or be able to hold your breath for an hour?
175,Would you rather be able to control fire or water?
176,Would you rather live in a world without music or a world without movies?
177,Would you rather be able to eat whatever you want without gaining weight or be able to sleep for only one hour a day and feel fully rested?
178,Would you rather have a magic carpet or a Nimbus 2000?
179,Would you rather be able to remember every dream you have ever had or be able to control your dreams?
180,Would you rather have a tail that wags when you are happy or ears that droop when you are sad?
181,Would you rather be able to fast forward through boring parts of your life or be able to replay your favorite memories?
182,Would you rather have a pet dragon or a pet unicorn?
183,Would you rather be able to talk to the dead or be able to see ghosts?
184,Would you rather have the power of super speed or the power of super strength?
185,Would you rather be able to control animals with your mind or be able to control technology with your mind?
186,Would you rather be able to heal any injury or illness or be able to bring people back from the dead?
187,Would you rather have a lightsaber or a sonic screwdriver?
188,Would you rather be able to create force fields or be able to turn invisible?
189,Would you rather be able to shapeshift into any animal or be able to shapeshift into any person?
190,Would you rather have a time machine that only goes to the past or a time machine that only goes to the future?
191,Would you rather be able to control gravity or be able to control time?
192,Would you rather have a bottomless pit of money or a bottomless pit of knowledge?
193,Would you rather be able to create life or be able to destroy it?
194,Would you rather be able to talk to aliens or be able to talk to angels?
195,Would you rather have a perfect memory of everything you have ever seen or a perfect memory of everything you have ever read?
196,Would you rather be able to control your own destiny or be able to control the destiny of others?
197,Would you rather have the power of creation or the power of destruction?
198,Would you rather be able to fly through space or be able to travel through time?
199,Would you rather have a world of peace or a world of excitement?
200,Would you rather be able to make anyone fall in love with you or be able to make anyone do whatever you want?
201,What celebrity would you rate as a perfect 10?
202,What’s something you’re certain you’ll never experience?
203,What’s the most ridiculous thing you’ve done because you were bored?
204,What’s the most imaginative insult you can come up with?
205,What’s the most useless thing you’ve ever learned?
206,What would be the absolute worst name you could give your child?
207,What’s the weirdest thing you’ve seen in someone else’s home?
208,What character in a movie could have been played by a completely different actor?
209,What would be the worst thing for the government to make illegal?
210,What song would you be least happy to have stuck in your head for a year?
211,What’s the most embarrassing thing you’ve ever done?
212,What’s your best “my life is a movie” moment?
213,What’s the most ridiculous thing you’ve convinced someone is true?
214,What’s the weirdest thing a guest has done at your house?
215,What’s the most embarrassing text you’ve sent to the wrong person?
216,What’s the funniest thing you’ve seen a stranger do?
217,What’s the most creative way you can think of to get out of a speeding ticket?
218,What’s the most absurd thing you’ve ever done on a dare?
219,What’s the strangest thing you’ve ever found in your pocket?
220,What’s the most ridiculous thing you’ve ever said with confidence?
221,What’s the funniest thing you’ve done while half-asleep?
222,What’s the most embarrassing thing you’ve worn in public?
223,What’s the most creative way you’ve ever quit a job?
224,What’s the weirdest thing you’ve ever done to impress someone?
225,What’s the funniest thing that’s ever happened to you in a bathroom?
226,What’s the most ridiculous thing you’ve ever done for money?
227,What’s the strangest thing you’ve ever seen on the side of the road?
228,What’s the most embarrassing thing you’ve ever been caught doing?
229,What’s the funniest thing you’ve ever heard a kid say?
230,What’s the most ridiculous thing you’ve ever done in the name of love?
231,What’s the weirdest thing you’ve ever seen at a wedding?
232,What’s the most embarrassing thing you’ve ever done on a date?
233,What’s the funniest thing you’ve ever seen an animal do?
234,What’s the most ridiculous thing you’ve ever done to get out of trouble?
235,What’s the weirdest thing you’ve ever seen on a security camera?
236,What’s the most embarrassing thing you’ve ever done at work?
237,What’s the funniest thing you’ve ever seen happen at a funeral?
238,What’s the most ridiculous thing you’ve ever done on vacation?
239,What’s the weirdest thing you’ve ever seen in a thrift store?
240,What’s the most embarrassing thing you’ve ever done in front of a celebrity?
241,What’s the funniest thing you’ve ever seen happen at a sporting event?
242,What’s the most ridiculous thing you’ve ever done to get someone’s attention?
243,What’s the weirdest thing you’ve ever seen happen on public transportation?
244,What’s the most embarrassing thing you’ve ever done at a party?
245,What’s the funniest thing you’ve ever seen happen in a library?
246,What’s the most ridiculous thing you’ve ever done to avoid talking to someone?
247,What’s the weirdest thing you’ve ever seen happen in a restaurant?
248,What’s the most embarrassing thing you’ve ever done in a classroom?
249,What’s the funniest thing you’ve ever seen happen at a concert?
250,What’s the most ridiculous thing you’ve ever done to win a bet?
251,Would you rather lose all of your memories or never be able to make new ones?
252,Is it possible to live a normal life and not tell a single lie?
253,Would you rather be able to control your own destiny or the destiny of others?
254,If you could ask a single person one question and they had to answer truthfully, who and what would you ask?
255,Would you rather know the answer to every question, but never be able to speak again, or be able to speak every language fluently?
256,Is it better to be respected or liked?
257,Would you rather have the ability to see 10 minutes into the future or 150 years into the future?
258,Does fate exist, and if so, do we have free will?
259,Would you rather live in a world without problems or a world where you are the only one who can solve them?
260,What does it mean to live a good life?
261,Would you rather find true love or win the lottery?
262,Is it more important to help yourself, help your family, help your society, or help the world?
263,Would you rather be able to communicate with animals or plants?
264,If you had to choose, would you rather be without art or science?
265,Would you rather know when you will die or how you will die?
266,Can happiness exist without sadness?
267,Would you rather have a rewind button or a pause button for your life?
268,If you could change one event in history, what would it be?
269,Would you rather be able to teleport anywhere or read minds?
270,What is the difference between living and existing?
271,Would you rather be forgotten or be remembered for something terrible?
272,Is humanity inherently good or evil?
273,Would you rather have the power to heal any injury or the power to bring people back from the dead?
274,If you could have any question answered, what would it be?
275,Would you rather live without music or without movies?
276,What is more important: knowledge or wisdom?
277,Would you rather be able to control fire or water?
278,If you could eliminate one emotion from your life, which one would it be?
279,Would you rather have super speed or super strength?
280,Is it possible for a society to exist without laws?
281,Would you rather be able to fly or be invisible?
282,What is more powerful: love or hate?
283,Would you rather be able to talk to your past self or your future self?
284,If you could create a new world, what would be the first thing you would do?
285,Would you rather have a perfect memory of everything you've ever seen or a perfect memory of everything you've ever read?
286,What is the true meaning of justice?
287,Would you rather be able to control your dreams or remember every dream you've ever had?
288,If you could have dinner with any three people from history, who would they be?
289,Would you rather have a world of peace or a world of excitement?
290,What is the most important quality in a person?
291,Would you rather be able to shapeshift into any animal or any person?
292,If you could change one thing about yourself, what would it be?
293,Would you rather have a time machine that only goes to the past or only to the future?
294,What is the nature of consciousness?
295,Would you rather have the power of creation or the power of destruction?
296,If you could live in any fictional universe, which one would you choose?
297,Would you rather be able to make anyone fall in love with you or make anyone do whatever you want?
298,What is the greatest human achievement?
299,Would you rather live a short, meaningful life or a long, meaningless one?
300,If you had to give up one of your five senses, which one would it be?
301,Would you rather be able to speak all human languages or be able to talk to animals?
302,What is the purpose of art in society?
303,Would you rather have the ability to change the past or see into the future?
304,If you could solve one world problem, which one would it be?
305,Would you rather be able to control the weather or be able to control technology with your mind?
306,What is the most important lesson you have learned in your life?
307,Would you rather have a personal chef or a personal driver for the rest of your life?
308,If you could ask the universe one question, what would it be?
309,Would you rather have unlimited money or unlimited time?
310,What is the relationship between the mind and the body?
311,Would you rather be able to breathe underwater or have the ability to fly?
312,If you could have any superpower for 24 hours, what would you choose?
313,Would you rather live in a utopia as a normal person or in a dystopia as a ruler?
314,What do you think happens after we die?
315,Would you rather be an amazing artist or a brilliant scientist?
316,If you could learn the truth behind one conspiracy theory, which one would it be?
317,Would you rather have the power of telekinesis or the power of telepathy?
318,What defines a successful life?
319,Would you rather be able to control your emotions completely or feel every emotion intensely?
320,If you could have written any book in history, which one would it be?
321,Would you rather be able to travel through space or travel through time?
322,What is the most beautiful thing in the world?
323,Would you rather have a photographic memory or an IQ of 200?
324,If you could make one law that everyone in the world had to follow, what would it be?
325,Would you rather be able to change your appearance at will or change your voice at will?
326,What is the meaning of friendship?
327,Would you rather be the funniest person alive or the most intelligent person alive?
328,If you could meet any mythological creature, which one would it be?
329,Would you rather have a house that cleans itself or a car that drives itself?
330,What is the best way to find happiness?
331,Would you rather know when a disaster will happen but be unable to stop it, or be able to stop it but not know when it will happen?
332,If you could be remembered for one thing, what would it be?
333,Would you rather always know when someone is lying or get away with any lie you tell?
334,What is the greatest challenge facing humanity today?
335,Would you rather be able to build anything you can imagine or fix anything that is broken?
336,If you could have a conversation with your younger self, what advice would you give?
337,Would you rather be able to see in the dark or have superhuman hearing?
338,What is the role of suffering in human life?
339,Would you rather be able to control your own destiny but no one else's, or control everyone else's destiny but not your own?
340,If you could have one wish granted, what would it be (and you can't wish for more wishes)?
341,Would you rather be able to create life or resurrect the dead?
342,What is the nature of good and evil?
343,Would you rather have a perfect understanding of the universe or a perfect understanding of yourself?
344,If you could choose your own cause of death, what would it be?
345,Would you rather be able to control gravity or control time?
346,What is the most important thing for a person to learn in their lifetime?
347,Would you rather have a bottomless bank account or a bottomless well of knowledge?
348,If you could have any job in the world, knowing you would be successful, what would it be?
349,Would you rather be able to talk to aliens or talk to angels?
350,What is the meaning of true freedom?
351,Would you rather live in a world with no emotions or a world with no logic?
352,Is it better to have loved and lost than never to have loved at all?
353,Would you rather be able to end all wars or end world hunger?
354,If you had to sacrifice one person to save five, would you do it?
355,Would you rather have the ability to instantly learn any skill or the ability to instantly master any instrument?
356,Do you believe in soulmates?
357,Would you rather have the power to make anyone happy or the power to make anyone successful?
358,If you could find out the exact date and time of your death, would you want to know?
359,Would you rather be able to see the future of the stock market or the future of weather patterns?
360,What makes a person truly wise?
361,Would you rather live in a world where everyone is immortal or a world where everyone dies at age 40?
362,If you could erase one memory from your mind, what would it be?
363,Would you rather be able to control the elements or control the minds of people?
364,Is it possible to be happy without being successful?
365,Would you rather be able to solve any math problem or be able to write the most beautiful poetry?
366,If you could choose to be born in any era, which would you choose?
367,Would you rather have the ability to talk to the dead or the ability to see ghosts?
368,What is the most valuable thing in the world that isn't money?
369,Would you rather be able to change your past or control your future?
370,If you could have a conversation with any animal, which would it be and why?
371,Would you rather be able to end all suffering or create infinite joy?
372,What is the meaning of sacrifice?
373,Would you rather be able to stop time for everyone but yourself, or fast-forward time?
374,If you could have any work of art in your home, which would it be?
375,Would you rather be able to predict the future with 100% accuracy or be able to change the past?
376,What does it mean to be truly free?
377,Would you rather have the power to create new planets or the power to explore the entire universe?
378,If you could spend a day in someone else's shoes, who would it be?
379,Would you rather be able to communicate with your future self or your past self?
380,What is the nature of beauty?
381,Would you rather be able to give anyone a perfect day or be able to take away their worst memory?
382,If you could have any fictional character as a mentor, who would you choose?
383,Would you rather have the ability to make anything you draw come to life or have a magical musical instrument?
384,What is the most important promise you have ever made to yourself?
385,Would you rather be able to know the complete history of any object you touch or be able to speak with the spirits of the dead?
386,If you could have a definitive answer to one of the great mysteries of the universe, what would you want to know?
387,Would you rather be able to make people forget things or make them remember things?
388,What is the greatest gift a person can receive?
389,Would you rather have the ability to grow any plant instantly or the ability to turn any object into gold?
390,If you could ask your pet three questions that they would answer truthfully, what would you ask?
391,Would you rather be able to control your own luck or be able to give good luck to others?
392,What is the meaning of a legacy?
393,Would you rather be able to perfectly replicate any meal you've ever eaten or be able to create entirely new flavors?
394,If you could have a personal library with every book ever written, but could only read ten, which would you choose?
395,Would you rather be able to understand the language of trees or the language of the ocean?
396,What is the one thing you would change about the world if you had the power to do so?
397,Would you rather have the ability to make anyone forgive you or the ability to make anyone tell the truth?
398,If you could have a conversation with your own subconscious, what would you ask?
399,Would you rather be able to experience the life of any of your ancestors for a day or get a glimpse of the life of a descendant 10 generations from now?
400,What is the meaning of home?
401,Would you rather have a key that can open any door or a map that shows the location of anything you desire?
402,If you could choose to be immune to one emotion, which would it be?
403,Would you rather be able to perfectly remember every conversation you've ever had or be able to perfectly predict the outcome of any conversation?
404,What is the most important thing to teach the next generation?
405,Would you rather have the ability to make people feel safe and secure or the ability to inspire people to achieve their dreams?
406,If you could have a mythical creature as a companion, which would you choose?
407,Would you rather be able to see the good in everyone or be able to see the truth in every situation?
408,What is the nature of time?
409,Would you rather be able to give life to inanimate objects or be able to communicate with machines?
410,If you could have a meal with any three fictional characters, who would they be?
411,Would you rather have the ability to make anyone laugh or the ability to comfort anyone who is sad?
412,What is the meaning of courage?
413,Would you rather be able to build a perfect society from scratch or be able to fix all the problems in our current society?
414,If you could have one piece of technology from a science fiction movie, what would it be?
415,Would you rather be able to see the potential in any person or the potential in any idea?
416,What is the most important decision you have ever made?
417,Would you rather have the ability to make any two people fall in love or the ability to peacefully resolve any conflict?
418,If you could have a soundtrack to your life, what songs would be on it?
419,Would you rather be able to remember everything you learn from books or everything you learn from experience?
420,What is the meaning of wisdom?
421,Would you rather have the ability to make plants grow at an accelerated rate or the ability to purify any body of water?
422,If you could witness any event in the future, what would it be?
423,Would you rather be able to create a new color or a new musical note?
424,What is the one thing you are most proud of in your life?
425,Would you rather be able to grant wishes for other people (but not yourself) or have three of your own wishes granted?
426,If you could have any animal's abilities for a day, which animal would you choose?
427,Would you rather be able to speak to your future grandchildren or your great-great-grandparents?
428,What is the meaning of hope?
429,Would you rather have the ability to make any food healthy or the ability to make any healthy food taste delicious?
430,If you could have a conversation with the Earth, what would you ask?
431,Would you rather be able to see the history of any place you visit or be able to see the possible futures of that place?
432,What is the most important quality in a leader?
433,Would you rather have the ability to make anyone feel understood or the ability to make anyone feel loved?
434,If you could choose a new national holiday, what would it be and how would it be celebrated?
435,Would you rather be able to control the stock market or be able to predict natural disasters?
436,What is the meaning of power?
437,Would you rather have the ability to make anyone your friend or the ability to make anyone your enemy?
438,If you could have any object from a museum, what would it be?
439,Would you rather be able to speak with your guardian angel or be able to see the invisible threads that connect all living things?
440,What is the most important lesson that history has taught us?
441,Would you rather have the ability to make people happy with your presence or the ability to make people successful with your advice?
442,If you could design your own heaven, what would it look like?
443,Would you rather be able to create a perfect clone of yourself or be able to transfer your consciousness into a new body?
444,What is the meaning of family?
445,Would you rather have the ability to make anyone feel confident or the ability to make anyone feel calm?
446,If you could have a conversation with your own mortality, what would you say?
447,Would you rather be able to see the best in people or be able to bring out the best in people?
448,What is the most important thing you have ever created?
449,Would you rather have the ability to make any dream a reality or the ability to enter and explore other people's dreams?
450,What is the meaning of a well-lived life?
451,What is the difference between good and bad people?
452,Is it essential to be a “good person”?
453,What makes people feel more attached to some people than others?
454,Is tribalism, or looking out for others like you, innately good, bad, or neutral?
455,If one existed apart from other humans, would they still value goodness?
456,Are there moral commonalities amongst diverse people groups and cultures?
457,Are individuals important, and if so, in what ways?
458,Are humans more important than other animals? Why or why not?
459,Are some people more important than others?
460,Is the death penalty right or wrong?
461,What should be the repercussions for wronging someone else?
462,Is wisdom a helpful tool?
463,Why is wisdom often associated with age?
464,If a person has an accident and is no longer able to contribute to society, has their value as a person decreased, increased, or stayed the same?
465,Can people change?
466,How does one become a “good person”?
467,If someone’s personality changes, does that mean they have also changed?
468,Can you ever honestly know another person?
469,If someone’s intentions were good but the outcome of an action is terrible, at that moment, is the person good or bad?
470,If someone does a kind deed but has a selfish motive, does that impact the goodness of the deed?
471,When babies are born, are they good?
472,If identical twins grew up never knowing each other, how similar and different would they be?
473,Is there ever a justifiable reason to kill someone?
474,Are people born with a specific personality, or is the character the result of their circumstances?
475,Is lying ever a good thing?
476,If you steal money but use it to save someone’s life, does that justify the theft?
477,Should someone being ignorant be a valid excuse for their rudeness?
478,Can we choose our emotions, or do they happen to us?
479,How do you know you are loved?
480,How do you know that you love someone?
481,Is the desire to be loved an innate human desire?
482,Why do people desire love?
483,Does love necessitate action, or can it exist simply as a feeling?
484,In what ways are love, lust, and sexual desire different from one another?
485,Is an understanding of pain necessary to appreciate love?
486,Does the loss of love change one’s outlook on life?
487,Can one show love without first being loved?
488,Are there different forms of love such as parental, friendship, or romantic?
489,Can romantic love for one person last forever?
490,Can love ever be a bad thing?
491,How does unreciprocated love affect people?
492,What does falling in love mean?
493,What causes someone to fall in love?
494,Does love feel different to different people?
495,Is love, health, or money more important?
496,Can you choose to feel love for someone?
497,Does being loved by more people correlate to a person’s value?
498,Is there a difference in depth of love versus quantity of love?
499,To love someone well, do you need to show their love how they want to be loved, or can you love them the way you naturally show love?
