500,Is there “The one?”
501,Do you need to love yourself before you can love others?
502,Is loving yourself selfish?
503,Is it essential to have a friendship with your partner?
504,If your partner grew up in an abusive household, are you more understanding of unhealthy behavior?
505,Are you currently dreaming, and how do you know?
506,Do memories exist even if you forget them?
507,Does grass feel pain when you step on it?
508,Can trees feel pain?
509,Does 1+1 always equal 2?
510,Would it be ethical, unethical, or neutral if time travel were possible?
511,If time travel were possible, would it be wrong to change history?
512,What is the purpose of humor?
513,Why are jokes funny?
514,If one person doesn’t find a joke funny, does it mean they have a lousy sense of humor, or is the joke flawed?
515,Are humans responsible in any way for caring for wild animals?
516,Can inanimate objects be either bad or good?
517,Does morality bind animals?
518,Is water wet?
519,Are hot dogs tacos?
520,Is it wrong to visit a zoo?
521,Is it wrong to purchase fast fashion?
522,In a fictional world, could you have a five-sided square?
523,How do we know what words mean?
524,Why do some people feel scared while watching a horror movie even though they know it is not real?
525,What would you say if you had five minutes to defend the human race in front of a group of aliens who were going to obliterate humanity?
526,Are there any physiological changes you would make humans make us a better species?
527,Should the legal age for alcohol consumption be different than it is?
528,If your life expectancy suddenly increased to 500 years, would you live differently than you currently are?
529,If immortality were possible, would you want to be immortal?
530,What are human rights?
531,Is autonomy a human right?
532,Is liberty a human right?
533,Is free speech a human right?
534,What is the difference between a human right and a privilege?
535,Is it the responsibility of privileged individuals or the government to bridge gaps between privileged and disadvantaged people?
536,If people are spreading misinformation, should they still be allowed to continue?
537,Should abortion be legal?
538,At what point in human development does one become a person and gain rights?
539,Is war ever necessary or even reasonable?
540,How can societies work to dismantle systemic racism, ableism, sexism, and other forms of discrimination?
541,If two people’s opinions differ, how should they resolve their differences?
542,Has technology made it easier or harder to advance human rights?
543,Is it the responsibility of wealthy countries to support impoverished countries?
544,Should women’s rights be a priority to men? Why or why not?
545,What makes a person a person?
546,If a person has lost consciousness and doctors know they will not regain it, but their organs are still functioning, are they still a person?
547,Is the internet good, bad, or neutral?
548,Is being able to financially support a family a human right, or is having a large family a privilege?
549,Do more humans have fundamental rights in the modern world, or have we lost human rights as time has progressed?
550,If you could ensure every person on the planet would have access to a single human right, which one would you choose?
551,What rights should prisoners of war have?
552,Do you think serial killers have an equal value to other people, or do their actions impact their value?
553,Is privacy a human right?
554,Is technological advancement minimizing our privacy?
555,Are there any innately evil governmental structures?
556,What would a perfect society look like?
557,How involved should governments be in caring for the individuals in their country?
558,If you could create your society, what would look different from the one where you live now?
559,What role should the government have in the lives of individuals?
560,What makes a good leader?
561,Is prison the best way to protect society and correct individuals?
562,Does the legal system function fairly?
563,Are taxes morally right?
564,Should it be lawful for citizens to hold protests?
565,What makes people work together despite differences?
566,Does societal advancement only happen with collaboration?
567,In what ways can disagreements advance society?
568,What makes a crime a crime?
569,How should citizens who believe the laws in their country be unjust behave?
570,Is it morally wrong to abstain from voting?
571,Is it wrong for governments not to have healthcare available to all citizens?
572,Should things that are bad for people be banned by the government, or is it the individual’s responsibility to avoid harmful substances?
573,Is there an age at which people should be answerable for their actions?
574,Is it discriminatory not to allow certain people to run for government office?
575,Is it okay to limit immigration if a country is worried it will lose its culture?
576,Should the government regulate what food manufacturers can and can’t put in their food?
577,Is the government responsible for ensuring people receive a livable wage?
578,Should those who live an unhealthy lifestyle have decreased access to healthcare?
579,What would the ideal government look like?
580,What is culture?
581,How does culture form?
582,Is it important to be mindful of other cultures, and if so, why?
583,Are some cultures better than others?
584,Is morality developed within a culture, or is it intrinsic?
585,Is there a wrong way to discipline children?
586,In what way is a family-oriented culture better or worse than an individualistic culture?
587,Are individualistic cultures intrinsically selfish?
588,Does income play a part in how you define success?
589,Does the culture you were raised in impact your outlook on life?
590,If someone has recently relocated to a new country, should there be leniency for breaking minor laws they did not know about?
591,If a group practices human sacrifice as part of their culture, does that make it okay?
592,Is attractiveness a cultural construct?
593,Where does the Earth come from?
594,Did a deity or event start the universe?
595,Does the universe’s origin affect how one lives?
596,Does the vastness of space impact the way you perceive yourself?
597,Do things about the universe imply it exists due to chance or design?
598,Is it the duty of those currently alive to be ecologically responsible?
599,Is the Earth the only planet inhabited by living beings?
600,Is anything in the world eternal?
601,Is time eternal?
602,Did time, as we now perceive it, start at a specific moment?
603,Will time continue to run after the human species no longer exists?
604,If we find another inhabitable planet, would there be any moral implications if humans left the earth and moved there?
605,Should space travel be accessible to all people?
606,Is it good, bad, or neutral that humans have invested so many resources into space exploration?
607,Is there a difference between faith and superstition?
608,If a deity exists, would it exist within our understanding of morality?
609,What does it mean to feel happy?
610,Why are some things right and some things wrong?
611,Is it necessary to be nice to people, and why?
612,What is kindness?
613,Is being kind and being nice the same thing?
614,What is the difference between good and evil?
615,What happens to pets when they die?
616,What are things that you know to be certain?
617,What is something that you believe and why?
618,If superheroes were real, would they be more responsible for protecting people than you are?
619,Does helping people make you feel good? Why or why not?
620,What is the difference between adults and children?
621,What, if anything, makes a person different from an animal?
622,Is social media good, bad, or neutral?
623,How do you know that you belong?
624,Is it wrong to kill one person if it might save the lives of hundreds of others?
625,Is using euthanasia to intentionally end a life to prevent further pain and suffering immoral?
626,Should people be allowed to commit medically induced suicide?
627,Was former President Harry Truman’s decision to drop the atomic bombs unethical?
628,Is bribery ever acceptable or ethical?
629,If your friend’s significant other flirts with you, should you tell your friend about it?
630,Is eating animals unethical or not?
631,Is it ethical to test products on animals?
632,Would it be wrong to use the lungs of a deceased person for a transplant if they were not a registered organ donor?
633,Is it okay to harm one person if it means protecting others?
634,Is being a billionaire in a world where people are starving unethical?
635,Is war ever ethical?
636,Is it possible to not believe anything, or does everyone have beliefs?
637,Is there a god?
638,Is there an afterlife?
639,Is your soul reborn after you die?
640,Does your worldview impact the way you make day-to-day decisions?
641,Where do people come from?
642,Is there such a thing as fate?
643,Is luck a real thing?
644,Does chance exist?
645,Does having a religious experience prove the existence of a god?
646,Is there absolute truth?
647,Who determines right from wrong?
648,Is the world progressively becoming worse?
649,Why does evil exist?
650,Are pain and beauty interconnected?
651,Is it a shared element between a beautiful person, experience, or memory?
652,Why do people value happiness, beauty, or joy?
653,If your life were to end tomorrow, would you be happy with how you had spent your time?
654,What would you want it to say if someone were to write a book about you?
655,What gives your life meaning and purpose?
656,Can pain be a good thing?
657,Does learning a valuable lesson through suffering make it worth it?
658,Is it essential to care for yourself, or is it more important to care for others?
659,What is “failure?”
660,Does failing at something mean you’re bad at it?
661,Would getting rid of negative traits like aggression in all humans have any negative consequences?
662,Would removing loss, sorrow, and pain impact one’s ability to enjoy life and love?
663,What is the difference between happiness and joy?
664,What makes you happy?
665,Can you choose to feel joy?
666,Why do friendships sometimes end?
667,What makes something “art?”
668,Is some art better than other art?
669,Does art need to make a statement or have a deeper meaning?
670,Is music art?
671,Should artists be held responsible for the message of their art?
672,Are artists morally obligated to give trigger warnings if their art could negatively impact someone?
673,Should there be age restrictions on specific pieces of art?
674,Should public nudity be acceptable when being presented as performance art?
675,Should everyone be able to interpret a piece of art as they see it, or is there a “correct” interpretation of an art piece?
676,Is it morally wrong for museums to display art that depicts slavery? Why or why not?
677,Should art taken as spoils of war be returned to the country it originated in?
678,Is it wrong for educators to assign reading that demonstrates racism?
679,Is it necessary to preserve history?
680,Is it morally acceptable to enjoy art made by someone who did horrible things?
681,Why do people enjoy looking at art?
682,Why does music connect people?
683,Should music be beautiful?
684,Is it essential for art to “make a statement?”
685,Would it be music if you and your friends were to hit pots and pans randomly?
686,If there is a room full of people talking, could that be categorized as music?
687,What is the difference between “good” taste in art or music and “bad” taste?
688,Can cooking be a form of art?
689,What is the critical difference between a functional and artistically designed room?
690,Is it possible that what one person sees as “yellow” is what someone else sees as “green,” but they’ve both learned to call it “yellow”?